{
  "schema_version": "1.0.0",
  "taxonomy": "cloud-providers",
  "title": "Enact Cloud Providers",
  "description": "Supported cloud infrastructure providers for Enact deployments",
  "providers": [
    {
      "slug": "digitalocean",
      "name": "DigitalOcean",
      "description": "Developer-friendly cloud with simple pricing and excellent documentation. Recommended for most Enact deployments.",
      "homepage": "https://www.digitalocean.com",
      "docs_url": "https://docs.digitalocean.com",
      "console_url": "https://cloud.digitalocean.com",
      "status_url": "https://status.digitalocean.com",
      "maturity": "stable",
      "tier": "primary",
      "cost_tier": "standard",
      "capabilities": [
        {
          "slug": "compute",
          "name": "Droplets",
          "available": true,
          "managed": false
        },
        {
          "slug": "managed-database",
          "name": "Managed Databases",
          "available": true,
          "managed": true,
          "notes": "PostgreSQL, MySQL, Redis"
        },
        {
          "slug": "managed-kubernetes",
          "name": "Kubernetes",
          "available": true,
          "managed": true
        },
        {
          "slug": "object-storage",
          "name": "Spaces",
          "available": true,
          "managed": true,
          "notes": "S3-compatible with CDN"
        },
        {
          "slug": "block-storage",
          "name": "Volumes",
          "available": true,
          "managed": true
        },
        {
          "slug": "load-balancer",
          "name": "Load Balancers",
          "available": true,
          "managed": true
        },
        {
          "slug": "firewall",
          "name": "Cloud Firewalls",
          "available": true,
          "managed": true
        },
        {
          "slug": "vpc",
          "name": "VPC",
          "available": true,
          "managed": true
        },
        {
          "slug": "floating-ip",
          "name": "Reserved IPs",
          "available": true,
          "managed": true
        },
        {
          "slug": "dns",
          "name": "DNS",
          "available": true,
          "managed": true,
          "notes": "Basic DNS hosting"
        },
        {
          "slug": "monitoring",
          "name": "Monitoring",
          "available": true,
          "managed": true
        }
      ],
      "regions": [
        {
          "slug": "nyc1",
          "name": "New York 1",
          "location": "New York, USA",
          "available": true
        },
        {
          "slug": "nyc3",
          "name": "New York 3",
          "location": "New York, USA",
          "available": true,
          "features": [
            "vpc",
            "managed-database"
          ]
        },
        {
          "slug": "sfo3",
          "name": "San Francisco 3",
          "location": "San Francisco, USA",
          "available": true,
          "features": [
            "vpc",
            "managed-database"
          ]
        },
        {
          "slug": "ams3",
          "name": "Amsterdam 3",
          "location": "Amsterdam, Netherlands",
          "available": true,
          "features": [
            "vpc",
            "managed-database"
          ]
        },
        {
          "slug": "sgp1",
          "name": "Singapore 1",
          "location": "Singapore",
          "available": true,
          "features": [
            "vpc",
            "managed-database"
          ]
        },
        {
          "slug": "lon1",
          "name": "London 1",
          "location": "London, UK",
          "available": true,
          "features": [
            "vpc",
            "managed-database"
          ]
        },
        {
          "slug": "fra1",
          "name": "Frankfurt 1",
          "location": "Frankfurt, Germany",
          "available": true,
          "features": [
            "vpc",
            "managed-database"
          ]
        },
        {
          "slug": "tor1",
          "name": "Toronto 1",
          "location": "Toronto, Canada",
          "available": true,
          "features": [
            "vpc",
            "managed-database"
          ]
        },
        {
          "slug": "blr1",
          "name": "Bangalore 1",
          "location": "Bangalore, India",
          "available": true,
          "features": [
            "vpc",
            "managed-database"
          ]
        },
        {
          "slug": "syd1",
          "name": "Sydney 1",
          "location": "Sydney, Australia",
          "available": true,
          "features": [
            "vpc",
            "managed-database"
          ]
        }
      ],
      "cli": {
        "name": "doctl",
        "install_url": "https://docs.digitalocean.com/reference/doctl/how-to/install/",
        "install_command": "brew install doctl",
        "auth_env_var": "DIGITALOCEAN_TOKEN",
        "version_command": "doctl version"
      },
      "api_base_url": "https://api.digitalocean.com/v2",
      "terraform_provider": "digitalocean/digitalocean",
      "supported_variants": [
        "minimal",
        "standard",
        "ha"
      ],
      "notes": "Recommended starting point for Enact. Simple, predictable pricing. Excellent for standard and HA variants.",
      "tags": [
        "recommended",
        "simple-pricing",
        "developer-friendly"
      ]
    },
    {
      "slug": "hetzner",
      "name": "Hetzner Cloud",
      "description": "European cloud provider with excellent price-to-performance ratio. Great for EU-based deployments.",
      "homepage": "https://www.hetzner.com/cloud",
      "docs_url": "https://docs.hetzner.com",
      "console_url": "https://console.hetzner.cloud",
      "status_url": "https://status.hetzner.com",
      "maturity": "stable",
      "tier": "primary",
      "cost_tier": "budget",
      "capabilities": [
        {
          "slug": "compute",
          "name": "Cloud Servers",
          "available": true,
          "managed": false
        },
        {
          "slug": "managed-database",
          "name": "Managed Databases",
          "available": false,
          "notes": "Not available, use self-hosted"
        },
        {
          "slug": "managed-kubernetes",
          "name": "Kubernetes",
          "available": true,
          "managed": true
        },
        {
          "slug": "object-storage",
          "name": "Object Storage",
          "available": true,
          "managed": true,
          "notes": "S3-compatible"
        },
        {
          "slug": "block-storage",
          "name": "Volumes",
          "available": true,
          "managed": true
        },
        {
          "slug": "load-balancer",
          "name": "Load Balancers",
          "available": true,
          "managed": true
        },
        {
          "slug": "firewall",
          "name": "Firewalls",
          "available": true,
          "managed": true
        },
        {
          "slug": "vpc",
          "name": "Networks",
          "available": true,
          "managed": true
        },
        {
          "slug": "floating-ip",
          "name": "Floating IPs",
          "available": true,
          "managed": true
        }
      ],
      "regions": [
        {
          "slug": "fsn1",
          "name": "Falkenstein",
          "location": "Falkenstein, Germany",
          "available": true
        },
        {
          "slug": "nbg1",
          "name": "Nuremberg",
          "location": "Nuremberg, Germany",
          "available": true
        },
        {
          "slug": "hel1",
          "name": "Helsinki",
          "location": "Helsinki, Finland",
          "available": true
        },
        {
          "slug": "ash",
          "name": "Ashburn",
          "location": "Ashburn, USA",
          "available": true
        },
        {
          "slug": "hil",
          "name": "Hillsboro",
          "location": "Hillsboro, USA",
          "available": true
        },
        {
          "slug": "sin",
          "name": "Singapore",
          "location": "Singapore",
          "available": true
        }
      ],
      "cli": {
        "name": "hcloud",
        "install_url": "https://github.com/hetznercloud/cli",
        "install_command": "brew install hcloud",
        "auth_env_var": "HCLOUD_TOKEN",
        "version_command": "hcloud version"
      },
      "api_base_url": "https://api.hetzner.cloud/v1",
      "terraform_provider": "hetznercloud/hcloud",
      "supported_variants": [
        "minimal",
        "standard",
        "ha"
      ],
      "notes": "Excellent value. No managed database - use self-hosted PostgreSQL or external service. EU data residency friendly.",
      "tags": [
        "budget",
        "eu-friendly",
        "high-performance"
      ]
    },
    {
      "slug": "aws",
      "name": "Amazon Web Services",
      "description": "Industry-leading cloud platform with comprehensive services. Best for enterprise deployments.",
      "homepage": "https://aws.amazon.com",
      "docs_url": "https://docs.aws.amazon.com",
      "console_url": "https://console.aws.amazon.com",
      "status_url": "https://health.aws.amazon.com",
      "maturity": "stable",
      "tier": "primary",
      "cost_tier": "premium",
      "capabilities": [
        {
          "slug": "compute",
          "name": "EC2",
          "available": true,
          "managed": false
        },
        {
          "slug": "managed-database",
          "name": "RDS",
          "available": true,
          "managed": true,
          "notes": "PostgreSQL, MySQL, Aurora"
        },
        {
          "slug": "managed-kubernetes",
          "name": "EKS",
          "available": true,
          "managed": true
        },
        {
          "slug": "object-storage",
          "name": "S3",
          "available": true,
          "managed": true
        },
        {
          "slug": "block-storage",
          "name": "EBS",